{
  "id": "video-dash-001",
  "title": "DASH streaming example",
  "description": "Video using MPEG-DASH manifest.",
  "createdAt": "2025-01-01T00:00:00Z",
  "thumbnail": "https://example.com/thumbs/dash.jpg",
  "duration": 320,
  "sources": [
    {
      "storageType": "http",
      "uri": "https://example.com/videos/dash-fallback.mp4"
    }
  ],
  "streaming": {
    "dash": "https://example.com/dash/manifest.mpd"
  }
}